A1: Name | B1: ID | C1: HW1 | D1: HW2 | E1: MID1 | F1: TOT | G1: GRADE | H1: HW3 | I1: HW4 | J1: MID2 | K1: HW5
A2: 4550 | C2: 50 | D2: 70 | E2: 80 | F2: =35*((C2+D2)/120)+65*(E2)/80 -> 100 | H2: 60 | I2: 80 | J2: 80 | K2: 60
B3: 1456 | C3: 43 | D3: 38 | E3: 62 | F3: =35*((C3+D3)/120)+65*(E3)/80 -> 74 | G3: C | H3: 54 | I3: 72 | J3: 69 | K3: 48
B4: 6874 | C4: 48 | D4: 68 | E4: 68.5 | F4: =35*((C4+D4)/120)+65*(E4)/80 -> 89.489583333333343 | G4: A- | H4: 58 | I4: 77 | J4: 61 | K4: 44
B5: 6923 | C5: 50 | D5: 33 | E5: 69 | F5: =35*((C5+D5)/120)+65*(E5)/80 -> 80.270833333333329 | G5: B- | H5: 46 | I5: 61 | J5: 44 | K5: 46
B6: 1123 | C6: 48 | G6: W
B7: 8117 | E7: 76 | F7: =35*((C7+D7)/120)+65*(E7)/80 -> 61.75 | G7: D | H7: 52 | I7: 73 | J7: 66 | K7: 51
B8: 6237 | C8: 50 | D8: 58 | E8: 69 | F8: =35*((C8+D8)/120)+65*(E8)/80 -> 87.5625 | G8: B+ | H8: 54 | I8: 78 | J8: 70 | K8: 56
B9: 1735 | C9: 50 | D9: 66 | E9: 77.5 | F9: =35*((C9+D9)/120)+65*(E9)/80 -> 96.802083333333343 | G9: A | H9: 60 | I9: 73 | J9: 73 | K9: 49
B10: 8759 | C10: 48 | D10: 61 | E10: 66.5 | F10: =35*((C10+D10)/120)+65*(E10)/80 -> 85.822916666666671 | G10: B | H10: 56 | I10: 69 | J10: 70 | K10: 49
B11: 4351 | C11: 50 | D11: 68 | E11: 80 | F11: =35*((C11+D11)/120)+65*(E11)/80 -> 99.416666666666657 | G11: A | H11: 60 | I11: 76 | J11: 78 | K11: 55
B12: 8662 | C12: 49 | D12: 48 | E12: 70.5 | F12: =35*((C12+D12)/120)+65*(E12)/80 -> 85.572916666666671 | G12: B | H12: 57 | I12: 67 | J12: 70 | K12: 53
B13: 1731 | C13: 50 | D13: 67 | E13: 78 | F13: =35*((C13+D13)/120)+65*(E13)/80 -> 97.5 | G13: A | H13: 60 | I13: 73 | J13: 74 | K13: 55
B14: 7902 | C14: 42 | D14: 55 | E14: 66.5 | F14: =35*((C14+D14)/120)+65*(E14)/80 -> 82.322916666666671 | G14: B- | H14: 43 | I14: 67 | J14: 65 | K14: 48
B15: 0919 | C15: 49 | D15: 67 | E15: 52.5 | F15: =35*((C15+D15)/120)+65*(E15)/80 -> 76.489583333333343 | G15: C | H15: 60 | I15: 73 | J15: 58.5 | K15: 50
B16: 5941 | C16: 50 | D16: 61 | E16: 76 | F16: =35*((C16+D16)/120)+65*(E16)/80 -> 94.125 | G16: A | H16: 60 | I16: 72 | J16: 67 | K16: 54
B17: 2685 | C17: 50 | D17: 64 | E17: 73 | F17: =35*((C17+D17)/120)+65*(E17)/80 -> 92.5625 | G17: A | H17: 55 | I17: 62 | J17: 84 | K17: 48
B18: 9741 | C18: 44 | D18: 64 | E18: 51 | F18: =35*((C18+D18)/120)+65*(E18)/80 -> 72.9375 | G18: C | I18: 65 | J18: 42 | K18: 51
B19: 1184 | C19: 43 | D19: 41 | E19: 67.5 | F19: =35*((C19+D19)/120)+65*(E19)/80 -> 79.34375 | G19: B- | H19: 17 | I19: 65 | J19: 54
B20: 9631 | C20: 50 | F20: =35*((C20+D20)/120)+65*(E20)/80 -> 14.583333333333334 | G20: F
B21: 7791 | C21: 50 | D21: 66 | E21: 77 | F21: =35*((C21+D21)/120)+65*(E21)/80 -> 96.395833333333343 | G21: A | H21: 57 | I21: 79 | J21: 73 | K21: 56
B22: 9325 | C22: 50 | D22: 68 | E22: 72 | F22: =35*((C22+D22)/120)+65*(E22)/80 -> 92.916666666666657 | G22: A | H22: 60 | I22: 73 | J22: 55 | K22: 58
B23: 4539 | G23: W
B24: 6630 | C24: 50 | D24: 60 | E24: 78 | F24: =35*((C24+D24)/120)+65*(E24)/80 -> 95.458333333333329 | G24: A | H24: 55 | I24: 75 | J24: 77 | K24: 53
B25: 3587 | C25: 50 | D25: 64 | E25: 54 | F25: =35*((C25+D25)/120)+65*(E25)/80 -> 77.125 | G25: C+ | H25: 60 | I25: 73 | J25: 40 | K25: 20
B26: 0577 | C26: 40.0 | D26: 55 | E26: 66 | F26: =35*((C26+D26)/120)+65*(E26)/80 -> 81.333333333333329 | G26: B- | H26: 48 | I26: 69 | J26: 70 | K26: 52
B27: 0934 | C27: 46.0 | G27: W
B28: 8098 | C28: 49.0 | D28: 61 | E28: 54 | F28: =35*((C28+D28)/120)+65*(E28)/80 -> 75.958333333333329 | G28: C | H28: 49 | I28: 69 | J28: 60 | K28: 46
B29: 6563 | C29: 50.0 | D29: 59 | E29: 77 | F29: =35*((C29+D29)/120)+65*(E29)/80 -> 94.354166666666671 | G29: A | H29: 57 | J29: 64
B30: 7464 | G30: W
B31: 6743 | C31: 43.0 | D31: 52 | E31: 65.5 | F31: =35*((C31+D31)/120)+65*(E31)/80 -> 80.927083333333329 | G31: B- | H31: 49 | I31: 62 | J31: 63
B32: 0698 | C32: 50.0 | D32: 66 | E32: 80 | F32: =35*((C32+D32)/120)+65*(E32)/80 -> 98.833333333333343 | G32: A | H32: 58 | I32: 80 | J32: 75 | K32: 58
A37: Name | B37: ID | C37: HW1 | D37: HW2 | E37: MID1 | F37: TOT | G37: GRADE | H37: HW3 | I37: HW4 | J37: MID2 | K37: HW5
A38: 6550 | C38: 50 | D38: 80 | E38: 80 | F38: =35*((C38+D38)/130)+65*(E38)/80 -> 100 | H38: 60 | I38: 80 | J38: 80 | K38: 60
B39: 4251 | C39: 50 | D39: 75 | E39: 77.5 | F39: =35*((C39+D39)/130)+65*(E39)/80 -> 96.62259615384616 | G39: A | H39: 59 | I39: 80 | J39: 80 | K39: 51
B40: 7421 | C40: 47 | D40: 77 | E40: 76 | F40: =35*((C40+D40)/130)+65*(E40)/80 -> 95.134615384615387 | G40: A | H40: 59 | I40: 73 | J40: 75 | K40: 58
B41: 2938 | C41: 47 | D41: 74 | E41: 78 | F41: =35*((C41+D41)/130)+65*(E41)/80 -> 95.95192307692308 | G41: A | H41: 55 | I41: 75 | J41: 77 | K41: 51
B42: 6573 | C42: 48 | D42: 76 | E42: 64.5 | F42: =35*((C42+D42)/130)+65*(E42)/80 -> 85.790865384615387 | G42: B | H42: 58 | I42: 80 | J42: 50 | K42: 52
B43: 6509 | C43: 44 | D43: 70 | E43: 73.5 | F43: =35*((C43+D43)/130)+65*(E43)/80 -> 90.411057692307693 | G43: A- | H43: 54 | I43: 80 | J43: 80 | K43: 57
B44: 9657 | C44: 48 | D44: 72 | E44: 74 | F44: =35*((C44+D44)/130)+65*(E44)/80 -> 92.432692307692307 | G44: A | H44: 59 | I44: 68 | J44: 51 | K44: 56
B45: 8214 | C45: 45 | D45: 75 | E45: 59.5 | F45: =35*((C45+D45)/130)+65*(E45)/80 -> 80.651442307692307 | G45: B- | H45: 56 | I45: 74 | J45: 66 | K45: 51
B46: 5946 | C46: 48 | D46: 72 | E46: 73 | F46: =35*((C46+D46)/130)+65*(E46)/80 -> 91.620192307692307 | G46: A- | H46: 58 | I46: 73 | J46: 65 | K46: 54
B47: 1093 | C47: 50 | D47: 67 | E47: 78 | F47: =35*((C47+D47)/130)+65*(E47)/80 -> 94.875 | G47: A | H47: 60 | I47: 78 | J47: 78 | K47: 58
B48: 8007 | C48: 49 | D48: 77 | E48: 78 | F48: =35*((C48+D48)/130)+65*(E48)/80 -> 97.29807692307692 | G48: A | H48: 60 | I48: 75 | J48: 79 | K48: 53
B49: 2102 | C49: 50 | D49: 76 | E49: 69 | F49: =35*((C49+D49)/130)+65*(E49)/80 -> 89.98557692307692 | G49: A- | H49: 60 | I49: 73 | J49: 59 | K49: 54
B50: 6810 | C50: 47 | D50: 66 | E50: 59.5 | F50: =35*((C50+D50)/130)+65*(E50)/80 -> 78.76682692307692 | G50: C+ | H50: 59 | I50: 73 | J50: 73 | K50: 57
B51: 8916 | C51: 47 | D51: 61 | E51: 60.5 | F51: =35*((C51+D51)/130)+65*(E51)/80 -> 78.23317307692308 | G51: C+ | H51: 57 | I51: 77 | J51: 75 | K51: 53
B52: 5124 | C52: 50 | D52: 79 | E52: 80 | F52: =35*((C52+D52)/130)+65*(E52)/80 -> 99.730769230769226 | G52: A | H52: 60 | I52: 80 | J52: 80 | K52: 60