B1: ID | C1: HW1 | D1: HW2 | E1: MID | F1: TOT | G1: GR. | H1: HW3 | I1: HW4 | J1: HW5 | K1: HW6 | L1: Paper
A2: 4560/6560 | C2: 50 | D2: 100 | E2: 30 | F2: =(100/30)*((C2+D2)/15+E2/1.5) -> 100 | H2: 60 | I2: 100 | J2: 40 | K2: 50 | L2: 100
B3: 3115 | C3: 50 | D3: 100 | E3: 23 | F3: =(100/30)*((C3+D3)/15+E3/1.5) -> 84.444444444444457 | G3: B | H3: 55 | I3: 100 | J3: 39 | K3: 50 | L3: 100
B4: 9452 | C4: 48 | D4: 75 | E4: 29 | F4: =(100/30)*((C4+D4)/15+E4/1.5) -> 91.777777777777771 | G4: A | H4: 45 | I4: 95 | L4: 90
B5: 2647 | C5: 48 | D5: 97 | E5: 26 | F5: =(100/30)*((C5+D5)/15+E5/1.5) -> 90 | G5: A- | H5: 59 | I5: 100 | J5: 40 | K5: 50 | L5: 90
B6: 2938 | C6: 41 | D6: 100 | E6: 28 | F6: =(100/30)*((C6+D6)/15+E6/1.5) -> 93.555555555555571 | G6: A | I6: 98 | J6: 33 | K6: 50 | L6: 100
B7: 8214 | C7: 46 | D7: 95 | E7: 21.5 | F7: =(100/30)*((C7+D7)/15+E7/1.5) -> 79.111111111111114 | G7: B- | H7: 58 | I7: 100 | J7: 40 | K7: 50 | L7: 100
B8: 9257 | C8: 50 | D8: 97 | E8: 25 | F8: =(100/30)*((C8+D8)/15+E8/1.5) -> 88.222222222222229 | G8: B+ | H8: 60 | I8: 98 | J8: 40 | K8: 50 | L8: 100
B9: 8007 | C9: 49 | D9: 100 | E9: 29 | F9: =(100/30)*((C9+D9)/15+E9/1.5) -> 97.555555555555557 | G9: A | H9: 58 | I9: 100 | J9: 40 | K9: 50 | L9: 100
B10: 7594 | C10: 48 | D10: 90 | E10: 20.5 | F10: =(100/30)*((C10+D10)/15+E10/1.5) -> 76.222222222222229 | G10: C | H10: 59 | I10: 100 | J10: 40 | K10: 50 | L10: 100
B11: 2684 | C11: 48 | D11: 97 | E11: 29 | F11: =(100/30)*((C11+D11)/15+E11/1.5) -> 96.666666666666671 | G11: A | H11: 58 | I11: 100 | J11: 40 | K11: 50 | L11: 100
B12: 9060 | C12: 50 | D12: 94 | E12: 28 | F12: =(100/30)*((C12+D12)/15+E12/1.5) -> 94.222222222222229 | G12: A | H12: 59 | I12: 90 | J12: 40 | K12: 50 | L12: 100
B13: 7865 | C13: 49 | E13: 24.5 | F13: =(100/30)*((C13+D13)/15+E13/1.5) -> 65.333333333333329 | H13: 55 | I13: 78 | J13: 28 | K13: 50 | L13: 90
B14: 6432 | C14: 50 | D14: 90 | E14: 25.5 | F14: =(100/30)*((C14+D14)/15+E14/1.5) -> 87.777777777777786 | G14: B+ | H14: 55 | I14: 97 | J14: 40 | K14: 50 | L14: 90