A1: Name | B1: ID | C1: HW1 | D1: HW2 | E1: MID1 | F1: HW3 | G1: HW4 | H1: MID2 | I1: TOT | J1: GRADE
A2: 4550 | C2: 70 | D2: 60 | E2: 80 | F2: 80 | G2: 100 | H2: 80 | I2: =30*((C2+D2+F2+G2)/310)+3*MAX(E2,H2)/8+MIN(E2,H2)/8 -> 70
B3: 3703 | C3: 37.5 | D3: 30.5 | E3: 69 | H3: 58 | I3: =30*((C3+D3+F3+G3)/310)+3*MAX(E3,H3)/8+MIN(E3,H3)/8 -> 39.70564516129032 | J3: D
B4: 4295 | C4: 62 | D4: 58 | E4: 62 | F4: 77 | G4: 76 | H4: 78 | I4: =30*((C4+D4+F4+G4)/310)+3*MAX(E4,H4)/8+MIN(E4,H4)/8 -> 63.41935483870968 | J4: A
B5: 1330 | C5: 56.5 | D5: 54 | E5: 49 | F5: 58 | G5: 87.5 | H5: 63 | I5: =30*((C5+D5+F5+G5)/310)+3*MAX(E5,H5)/8+MIN(E5,H5)/8 -> 54.524193548387096 | J5: B
B6: 0264 | C6: 64 | D6: 48.5 | E6: 76 | F6: 74 | G6: 91 | H6: 82 | I6: =30*((C6+D6+F6+G6)/310)+3*MAX(E6,H6)/8+MIN(E6,H6)/8 -> 67.104838709677423 | J6: A
B7: 2406 | C7: 55 | D7: 57.5 | E7: 70 | F7: 66 | G7: 68 | H7: 74 | I7: =30*((C7+D7+F7+G7)/310)+3*MAX(E7,H7)/8+MIN(E7,H7)/8 -> 60.354838709677423 | J7: B
B8: 3002 | C8: 27.5 | E8: 72 | F8: 67 | G8: 75 | H8: 72 | I8: =30*((C8+D8+F8+G8)/310)+3*MAX(E8,H8)/8+MIN(E8,H8)/8 -> 52.403225806451616 | J8: C
B9: 4964 | C9: 57.5 | D9: 49 | E9: 67 | F9: 63 | G9: 76 | H9: 61 | I9: =30*((C9+D9+F9+G9)/310)+3*MAX(E9,H9)/8+MIN(E9,H9)/8 -> 56.508064516129032 | J9: B
B10: 1102 | C10: 55 | D10: 45.5 | E10: 65 | F10: 50 | I10: =30*((C10+D10+F10+G10)/310)+3*MAX(E10,H10)/8+MIN(E10,H10)/8 -> 47.064516129032256 | J10: w
B11: 4351 | C11: 66 | D11: 49.5 | E11: 63.5 | F11: 64 | G11: 99 | H11: 77 | I11: =30*((C11+D11+F11+G11)/310)+3*MAX(E11,H11)/8+MIN(E11,H11)/8 -> 63.764112903225808 | J11: A
B12: 0522 | C12: 60 | D12: 53 | E12: 69.5 | F12: 75 | G12: 96 | H12: 74 | I12: =30*((C12+D12+F12+G12)/310)+3*MAX(E12,H12)/8+MIN(E12,H12)/8 -> 63.921370967741936 | J12: A
B13: 8741 | C13: 55 | D13: 41.5 | E13: 58.5 | F13: 73 | G13: 89.5 | H13: 56 | I13: =30*((C13+D13+F13+G13)/310)+3*MAX(E13,H13)/8+MIN(E13,H13)/8 -> 54.002016129032256 | J13: B
B14: 6575 | C14: 61 | D14: 52 | E14: 70 | F14: 77 | G14: 96.5 | H14: 77 | I14: =30*((C14+D14+F14+G14)/310)+3*MAX(E14,H14)/8+MIN(E14,H14)/8 -> 65.350806451612897 | J14: A
B15: 2332 | C15: 42 | D15: 47 | E15: 45.5 | F15: 54 | G15: 55 | H15: 51 | I15: =30*((C15+D15+F15+G15)/310)+3*MAX(E15,H15)/8+MIN(E15,H15)/8 -> 43.973790322580641 | J15: D
B16: 2200 | C16: 59 | D16: 45.5 | E16: 62.5 | F16: 75 | G16: 75 | H16: 79 | I16: =30*((C16+D16+F16+G16)/310)+3*MAX(E16,H16)/8+MIN(E16,H16)/8 -> 62.066532258064512 | J16: B
B17: 5580 | C17: 52.5 | D17: 36.5 | E17: 59 | F17: 79 | G17: 71 | H17: 77 | I17: =30*((C17+D17+F17+G17)/310)+3*MAX(E17,H17)/8+MIN(E17,H17)/8 -> 59.379032258064512 | J17: B
B18: 7994 | C18: 62.5 | D18: 47 | E18: 70 | F18: 68 | G18: 82 | H18: 81.5 | I18: =30*((C18+D18+F18+G18)/310)+3*MAX(E18,H18)/8+MIN(E18,H18)/8 -> 64.425403225806448 | J18: A
B19: 9852 | C19: 28 | D19: 45 | E19: 46 | F19: 64 | G19: 67 | H19: 71 | I19: =30*((C19+D19+F19+G19)/310)+3*MAX(E19,H19)/8+MIN(E19,H19)/8 -> 52.116935483870968 | J19: C
B20: 6306 | C20: 60 | D20: 50 | E20: 54.5 | F20: 68 | G20: 69.5 | H20: 76.5 | I20: =30*((C20+D20+F20+G20)/310)+3*MAX(E20,H20)/8+MIN(E20,H20)/8 -> 59.451612903225808 | J20: B
B21: 5098 | C21: 39.5 | D21: 33 | E21: 32.5 | I21: =30*((C21+D21+F21+G21)/310)+3*MAX(E21,H21)/8+MIN(E21,H21)/8 -> 23.266129032258064 | J21: F
B22: 6993 | C22: 22.5 | D22: 48.5 | E22: 55.5 | F22: 57 | G22: 69 | H22: 65 | I22: =30*((C22+D22+F22+G22)/310)+3*MAX(E22,H22)/8+MIN(E22,H22)/8 -> 50.377016129032256 | J22: C
B23: 8014 | C23: 61 | D23: 59 | E23: 68 | F23: 77 | G23: 97 | H23: 80 | I23: =30*((C23+D23+F23+G23)/310)+3*MAX(E23,H23)/8+MIN(E23,H23)/8 -> 66.951612903225808 | J23: A
B24: 0626 | C24: 62.5 | D24: 58 | E24: 68 | F24: 71 | G24: 76.5 | H24: 63.5 | I24: =30*((C24+D24+F24+G24)/310)+3*MAX(E24,H24)/8+MIN(E24,H24)/8 -> 59.372983870967744 | J24: B
B25: 8293 | C25: 65.5 | D25: 58 | E25: 43 | F25: 78 | G25: 95 | H25: 76 | I25: =30*((C25+D25+F25+G25)/310)+3*MAX(E25,H25)/8+MIN(E25,H25)/8 -> 62.568548387096769 | J25: A
A29: Name | B29: ID | C29: HW1 | D29: HW2 | E29: MID1 | F29: HW3 | G29: HW4 | H29: MID2 | I29: TOT | J29: GRADE
A30: 6550 | C30: 70 | D30: 60 | E30: 90 | F30: 80 | G30: 100 | H30: 95 | I30: =30*((C30+D30+F30+G30)/310)+3*MAX(E30/9,H30/9.5)+MIN(E30/9,H30/9.5) -> 70
B31: 0326 | C31: 65 | D31: 60 | E31: 67 | F31: 76 | G31: 94 | H31: 95 | I31: =30*((C31+D31+F31+G31)/310)+3*MAX(E31/9,H31/9.5)+MIN(E31/9,H31/9.5) -> 65.992831541218635 | J31: A
B32: 9512 | C32: 53 | D32: 49 | E32: 62.5 | F32: 70 | G32: 74.5 | H32: 67 | I32: =30*((C32+D32+F32+G32)/310)+3*MAX(E32/9,H32/9.5)+MIN(E32/9,H32/9.5) -> 51.957177890963962 | J32: C
B33: 9227 | C33: 64.5 | D33: 59 | E33: 79 | F33: 79 | G33: 100 | H33: 78.5 | I33: =30*((C33+D33+F33+G33)/310)+3*MAX(E33/9,H33/9.5)+MIN(E33/9,H33/9.5) -> 63.870684776457274 | J33: A
B34: 6034 | C34: 66.5 | D34: 55 | E34: 53 | F34: 80 | G34: 100 | H34: 87 | I34: =30*((C34+D34+F34+G34)/310)+3*MAX(E34/9,H34/9.5)+MIN(E34/9,H34/9.5) -> 62.539992454253905 | J34: B
B35: 2274 | C35: 51.5 | D35: 50 | E35: 63 | F35: 66 | G35: 77 | H35: 62 | I35: =30*((C35+D35+F35+G35)/310)+3*MAX(E35/9,H35/9.5)+MIN(E35/9,H35/9.5) -> 51.187606112054326 | J35: C
B36: 9312 | C36: 68.5 | D36: 59 | E36: 72 | F36: 80 | G36: 100 | H36: 84 | I36: =30*((C36+D36+F36+G36)/310)+3*MAX(E36/9,H36/9.5)+MIN(E36/9,H36/9.5) -> 64.284380305602724 | J36: A
B37: 6102 | C37: 61.5 | D37: 54 | E37: 68 | F37: 75 | G37: 99.5 | H37: 77 | I37: =30*((C37+D37+F37+G37)/310)+3*MAX(E37/9,H37/9.5)+MIN(E37/9,H37/9.5) -> 59.935861158272019 | J37: B
B38: 8596 | C38: 57.5 | D38: 52.5 | E38: 82 | F38: 77 | G38: 76.5 | H38: 86 | I38: =30*((C38+D38+F38+G38)/310)+3*MAX(E38/9,H38/9.5)+MIN(E38/9,H38/9.5) -> 61.885964912280699 | J38: B
B39: 9187 | C39: 69 | D39: 57.5 | E39: 89 | F39: 80 | G39: 99 | H39: 88 | I39: =30*((C39+D39+F39+G39)/310)+3*MAX(E39/9,H39/9.5)+MIN(E39/9,H39/9.5) -> 68.494340690435763 | J39: A
B40: 2373 | C40: 69 | D40: 57 | E40: 75 | F40: 75 | G40: 88.5 | H40: 87.5 | I40: =30*((C40+D40+F40+G40)/310)+3*MAX(E40/9,H40/9.5)+MIN(E40/9,H40/9.5) -> 63.981041312959825 | J40: A
B41: 9362 | C41: 66 | D41: 53.5 | E41: 84.5 | F41: 77 | G41: 85 | H41: 93.5 | I41: =30*((C41+D41+F41+G41)/310)+3*MAX(E41/9,H41/9.5)+MIN(E41/9,H41/9.5) -> 66.157140162233546 | J41: A
B42: 0568 | C42: 68 | D42: 57 | E42: 75 | F42: 74 | G42: 79 | H42: 90 | I42: =30*((C42+D42+F42+G42)/310)+3*MAX(E42/9,H42/9.5)+MIN(E42/9,H42/9.5) -> 63.657611771363896 | J42: A
B43: 4912 | C43: 64 | D43: 40 | E43: 75 | F43: 80 | G43: 100 | H43: 93 | I43: =30*((C43+D43+F43+G43)/310)+3*MAX(E43/9,H43/9.5)+MIN(E43/9,H43/9.5) -> 65.18562535370684 | J43: A
B44: 8788 | C44: 56 | D44: 52 | E44: 70 | F44: 74 | G44: 91 | H44: 90.5 | I44: =30*((C44+D44+F44+G44)/310)+3*MAX(E44/9,H44/9.5)+MIN(E44/9,H44/9.5) -> 62.776079984908513 | J44: A
B45: 8716 | C45: 65.5 | D45: 48 | E45: 86 | F45: 80 | G45: 83 | H45: 90 | I45: =30*((C45+D45+F45+G45)/310)+3*MAX(E45/9,H45/9.5)+MIN(E45/9,H45/9.5) -> 64.898415393322011 | J45: A