A1: 8950 Students
A2: Name | B2: ID | C2: HW1 | D2: HW2 | E2: HW3 | F2: HW4 | G2: EXAM1 | H2: Total | I2: GRADE | J2: HW5 | K2: HW6A | L2: HW6B | M2: Paper
A3: Full score= | C3: 50 | D3: 80 | E3: 100 | F3: 50 | G3: 30 | H3: =(C3+D3+E3+F3)*45/280+G3*55/30 -> 100.0 | J3: 100 | K3: 40 | L3: 50 | M3: 100
B4: 6564 | C4: 46 | D4: 80 | E4: 100 | F4: 50 | G4: 29 | H4: =(C4+D4+E4+F4)*45/280+G4*55/30 -> 97.523809523809518 | I4: A | J4: 100 | K4: 38 | L4: 50 | M4: 100
B5: 2866 | C5: 44.5 | D5: 75 | E5: 100 | F5: 50 | G5: 28 | H5: =(C5+D5+E5+F5)*45/280+G5*55/30 -> 94.645833333333343 | I5: A | J5: 100 | K5: 33 | L5: 50 | M5: 100
B6: 9529 | C6: 34 | D6: 80 | E6: 100 | F6: 45 | G6: 28 | H6: =(C6+D6+E6+F6)*45/280+G6*55/30 -> 92.958333333333343 | I6: A | J6: 100 | K6: 39 | L6: 50 | M6: 100
B7: 9620 | C7: 31.5 | D7: 78 | E7: 100 | F7: 50 | G7: 28 | H7: =(C7+D7+E7+F7)*45/280+G7*55/30 -> 93.038690476190482 | I7: A | J7: 100 | K7: 37 | L7: 50 | M7: 100
B8: 9714 | C8: 40 | D8: 80 | E8: 90 | F8: 40 | G8: 13.5 | H8: =(C8+D8+E8+F8)*45/280+G8*55/30 -> 64.928571428571431 | I8: D | J8: 100 | K8: 37 | L8: 50 | M8: 95
B9: 9190 | C9: 43 | D9: 80 | E9: 90 | F9: 40 | G9: 28 | H9: =(C9+D9+E9+F9)*45/280+G9*55/30 -> 91.99404761904762 | I9: A- | J9: 100 | K9: 38 | L9: 50 | M9: 100
B10: 1875 | C10: 43.5 | D10: 80 | E10: 100 | F10: 46 | G10: 24 | H10: =(C10+D10+E10+F10)*45/280+G10*55/30 -> 87.3125 | I10: B+ | J10: 100 | K10: 38 | L10: 50 | M10: 100
B11: 6077 | C11: 49 | D11: 80 | E11: 100 | F11: 50 | G11: 29 | H11: =(C11+D11+E11+F11)*45/280+G11*55/30 -> 98.00595238095238 | I11: A | J11: 100 | K11: 35 | L11: 50 | M11: 100
B12: 8670 | C12: 44 | D12: 80 | E12: 100 | F12: 50 | G12: 26 | H12: =(C12+D12+E12+F12)*45/280+G12*55/30 -> 91.702380952380949 | I12: A- | J12: 100 | K12: 40 | L12: 50 | M12: 100
B13: 6519 | C13: 45 | D13: 80 | E13: 100 | F13: 50 | G13: 29 | H13: =(C13+D13+E13+F13)*45/280+G13*55/30 -> 97.363095238095241 | I13: A | J13: 100 | K13: 28 | L13: 50 | M13: 95
B14: 8312 | C14: 49 | D14: 80 | E14: 100 | F14: 50 | G14: 26 | H14: =(C14+D14+E14+F14)*45/280+G14*55/30 -> 92.50595238095238 | I14: A | J14: 100 | K14: 39.5 | L14: 50 | M14: 95
B15: 8681 | C15: 43 | D15: 80 | E15: 100 | F15: 48 | G15: 28 | H15: =(C15+D15+E15+F15)*45/280+G15*55/30 -> 94.886904761904759 | I15: A | J15: 100 | K15: 40 | L15: 50 | M15: 100
B16: 7925 | C16: 43 | D16: 75 | E16: 100 | F16: 40 | G16: 27.5 | H16: =(C16+D16+E16+F16)*45/280+G16*55/30 -> 91.88095238095238 | I16: A- | J16: 100 | K16: 34 | M16: 100
B17: 1124 | C17: 39 | D17: 80 | E17: 100 | F17: 39 | G17: 26 | H17: =(C17+D17+E17+F17)*45/280+G17*55/30 -> 89.13095238095238 | I17: B+ | J17: 100 | K17: 38 | L17: 50 | M17: 100
B18: 6083 | C18: 47 | D18: 75 | E18: 100 | F18: 50 | G18: 30 | H18: =(C18+D18+E18+F18)*45/280+G18*55/30 -> 98.714285714285722 | I18: A | J18: 100 | K18: 37.5 | L18: 50 | M18: 100
B19: 9444 | C19: 48.5 | D19: 80 | E19: 100 | F19: 45 | G19: 28 | H19: =(C19+D19+E19+F19)*45/280+G19*55/30 -> 95.288690476190482 | I19: A | J19: 100 | K19: 40 | L19: 50 | M19: 100
B20: 2274 | C20: 46 | D20: 80 | E20: 100 | F20: 45 | G20: 27 | H20: =(C20+D20+E20+F20)*45/280+G20*55/30 -> 93.053571428571431 | I20: A | J20: 100 | K20: 30.5 | L20: 50 | M20: 90
B21: 6359 | C21: 45 | D21: 80 | E21: 100 | F21: 50 | G21: 24 | H21: =(C21+D21+E21+F21)*45/280+G21*55/30 -> 88.196428571428569 | I21: B+ | J21: 100 | K21: 37 | L21: 50 | M21: 100