A1: 8950 Students
A2: Name | B2: ID | C2: HW1 | D2: HW2 | E2: HW3 | F2: HW4 | G2: MID | H2: Tot | I2: GR | J2: HW5 | K2: HW6 | L2: HW7 | M2: Paper
A3: Full score= | C3: 50 | D3: 100 | E3: 100 | F3: 50 | G3: 30 | H3: =(100/35)*((C3+D3+E3+F3)*15/300+G3/1.5) -> 100.0 | J3: 100 | K3: 50 | L3: 40 | M3: 100
B4: 6813 | C4: 39 | D4: 100 | E4: 100 | F4: 47.5 | G4: 29 | H4: =(100/35)*((C4+D4+E4+F4)*15/300+G4/1.5) -> 96.166666666666657 | I4: A | J4: 100 | K4: 50 | L4: 37 | M4: 85
B5: 7421 | C5: 43 | D5: 100 | E5: 100 | F5: 50 | G5: 24.5 | H5: =(100/35)*((C5+D5+E5+F5)*15/300+G5/1.5) -> 88.523809523809533 | I5: B+ | J5: 100 | K5: 50 | L5: 35 | M5: 100
B6: 5216 | C6: 44.5 | D6: 99 | E6: 100 | F6: 49 | G6: 24.5 | H6: =(100/35)*((C6+D6+E6+F6)*15/300+G6/1.5) -> 88.452380952380949 | I6: B+ | J6: 100 | K6: 50 | L6: 40 | M6: 90
B7: 4260 | C7: 44 | D7: 90 | E7: 100 | F7: 46 | G7: 29 | H7: =(100/35)*((C7+D7+E7+F7)*15/300+G7/1.5) -> 95.238095238095227 | I7: A | J7: 100 | K7: 50 | L7: 34 | M7: 95
B8: 4458 | C8: 48.5 | D8: 100 | E8: 100 | F8: 45 | G8: 21.5 | H8: =(100/35)*((C8+D8+E8+F8)*15/300+G8/1.5) -> 82.88095238095238 | I8: B | J8: 100 | K8: 50 | L8: 37 | M8: 95
B9: 4452 | C9: 43 | E9: 100 | F9: 42 | G9: 28 | H9: =(100/35)*((C9+D9+E9+F9)*15/300+G9/1.5) -> 79.761904761904773 | I9: B- | J9: 100 | K9: 50 | L9: 38 | M9: 100
B10: 3115 | C10: 50 | D10: 100 | E10: 100 | F10: 47 | G10: 29.5 | H10: =(100/35)*((C10+D10+E10+F10)*15/300+G10/1.5) -> 98.61904761904762 | I10: A | J10: 100 | K10: 50 | L10: 35 | M10: 100
B11: 3215 | C11: 45 | D11: 100 | E11: 100 | F11: 42 | G11: 29 | H11: =(100/35)*((C11+D11+E11+F11)*15/300+G11/1.5) -> 96.238095238095227 | I11: A | J11: 100 | K11: 50 | L11: 37 | M11: 90
B12: 9731 | C12: 47 | D12: 100 | E12: 100 | F12: 50 | G12: 29 | H12: =(100/35)*((C12+D12+E12+F12)*15/300+G12/1.5) -> 97.666666666666657 | I12: A | J12: 100 | K12: 50 | L12: 40 | M12: 100
B13: 9861 | C13: 47 | D13: 100 | E13: 100 | F13: 47 | G13: 25 | H13: =(100/35)*((C13+D13+E13+F13)*15/300+G13/1.5) -> 89.61904761904762 | I13: B+ | J13: 100 | K13: 50 | L13: 34 | M13: 90
B14: 5946 | C14: 43 | D14: 95 | E14: 100 | F14: 40 | G14: 25.5 | H14: =(100/35)*((C14+D14+E14+F14)*15/300+G14/1.5) -> 88.285714285714278 | I14: B+ | J14: 100 | K14: 50 | L14: 40 | M14: 90
B15: 4264 | C15: 49 | D15: 100 | E15: 100 | F15: 49.5 | G15: 20 | H15: =(100/35)*((C15+D15+E15+F15)*15/300+G15/1.5) -> 80.738095238095241 | I15: B- | J15: 100 | K15: 50 | L15: 24 | M15: 90
B16: 9369 | C16: 46 | D16: 95 | E16: 100 | F16: 45 | G16: 28 | H16: =(100/35)*((C16+D16+E16+F16)*15/300+G16/1.5) -> 94.190476190476204 | I16: A | J16: 100 | K16: 50 | L16: 37 | M16: 90
B17: 6349 | C17: 48 | D17: 100 | E17: 100 | F17: 42 | G17: 26 | H17: =(100/35)*((C17+D17+E17+F17)*15/300+G17/1.5) -> 90.952380952380949 | I17: A- | J17: 100 | K17: 50 | L17: 38 | M17: 90
B18: 4227 | C18: 44.5 | D18: 100 | E18: 100 | F18: 47 | G18: 20 | H18: =(100/35)*((C18+D18+E18+F18)*15/300+G18/1.5) -> 79.738095238095241 | I18: B- | J18: 100 | K18: 50 | L18: 27 | M18: 85
B19: 4169 | C19: 45.5 | D19: 95 | E19: 100 | F19: 50 | G19: 28 | H19: =(100/35)*((C19+D19+E19+F19)*15/300+G19/1.5) -> 94.833333333333343 | I19: A | J19: 100 | K19: 50 | L19: 34 | M19: 100
B20: 1379 | C20: 44 | D20: 100 | E20: 100 | F20: 50 | G20: 30 | H20: =(100/35)*((C20+D20+E20+F20)*15/300+G20/1.5) -> 99.142857142857153 | I20: A | J20: 100 | K20: 50 | L20: 40 | M20: 90
B21: 9863 | C21: 45.5 | D21: 100 | E21: 100 | F21: 47 | G21: 27.5 | H21: =(100/35)*((C21+D21+E21+F21)*15/300+G21/1.5) -> 94.166666666666657 | I21: A | J21: 100 | K21: 50 | L21: 27 | M21: 90
B22: 1837 | C22: 45.5 | D22: 100 | E22: 100 | F22: 45 | G22: 28 | H22: =(100/35)*((C22+D22+E22+F22)*15/300+G22/1.5) -> 94.833333333333343 | I22: A | J22: 100 | K22: 50 | L22: 37 | M22: 100
B23: 0073 | C23: 49 | D23: 100 | E23: 100 | F23: 50 | G23: 28.5 | H23: =(100/35)*((C23+D23+E23+F23)*15/300+G23/1.5) -> 97.0 | I23: A | J23: 100 | K23: 50 | L23: 27 | M23: 100
B24: 4332 | C24: 44.5 | D24: 100 | E24: 100 | F24: 47 | G24: 30 | H24: =(100/35)*((C24+D24+E24+F24)*15/300+G24/1.5) -> 98.785714285714292 | I24: A | J24: 100 | K24: 50 | L24: 34 | M24: 95
B25: 6432 | C25: 44 | D25: 100 | E25: 100 | F25: 45 | G25: 22.5 | H25: =(100/35)*((C25+D25+E25+F25)*15/300+G25/1.5) -> 84.142857142857139 | I25: B | J25: 100 | K25: 50 | L25: 36 | M25: 95
B26: 0442 | C26: 46 | D26: 100 | E26: 100 | F26: 47 | G26: 22.5 | H26: =(100/35)*((C26+D26+E26+F26)*15/300+G26/1.5) -> 84.714285714285708 | I26: B | J26: 100 | K26: 50 | L26: 37 | M26: 100